{"run":17,"commit":"c3d3e0a","metric":86.9,"metrics":{"reliability":95.6,"performance":92.8,"cost":72.2,"searchable_prose_pct":100,"search_p95_ms":273.4,"findability_pct":100,"coverage_sessions_pct":100,"mrr":0.1351,"workload_kch":931.7,"cold_index_s":37.94,"findability_deep_pct":86.8,"index_mb":768.1},"status":"keep","description":"Refuse an index written by a newer recall instead of downgrading it. A version mismatch was treated as one case — outdated, rebuild — which is right in one direction and destructive in the other: this build rewrote a v9 marker to v6 and wrote its own row shape into the table, losing whatever the newer build recorded. The newer tool then finds an old index and rebuilds it forward, and the two take turns destroying each other's work at minutes a cycle. Not theoretical here: this machine runs several agents and the pi extension carries its own recall binary, so two versions against one shared index is the normal state during an upgrade. Both read and write paths now compare numerically and stop when the index is ahead, naming the fix (upgrade recall) rather than the one that loses data; an unparseable marker predates numbered versions and is still treated as older. Verified the file is untouched afterwards — marker still 9, rows intact. Same family as the previous round's fix: a version number was trusted where the actual shape or ordering had to be checked. No metric movement expected; 86.9 is unchanged within cold_index noise.","timestamp":1785580685451,"segment":0}
{"run":18,"commit":"08457c7","metric":84.9,"metrics":{"reliability":91.7,"performance":90.9,"cost":72.2,"searchable_prose_pct":100,"search_p95_ms":275.1,"findability_pct":98,"coverage_sessions_pct":100,"mrr":0.1351,"workload_kch":931.7,"cold_index_s":49.06,"findability_deep_pct":80.3,"index_mb":766.5},"status":"keep","description":"Two regression tests, no behaviour change — both for cases the benchmark cannot reach, chosen after a review showed this session's real wins were unhandled conditionals rather than tuning. (1) A half-written final line: agents append to session files while recall indexes them, so the last line is routinely incomplete; if the checkpoint advanced past those bytes the message would be lost permanently. scanLines already declines to count an unterminated line — correct by construction, invisible in the code, silent if broken. (2) Tags across a schema upgrade: the only data in the index that cannot be rebuilt from source, and the migration now drops tables, so the promise sits one careless DROP from being false. Verified on a copy of a real index too. Score 86.9 -> 84.9 is entirely measurement: the corpus grew 1694 -> 1701 sessions between runs (my own work adds sessions), so the audit samples different sessions — findability 100 -> 98, findability_deep 86.8 -> 80.3 on 71 samples, cold_index 49s under contention. content_found_pct rose 95.6 -> 97.2 over the same period, which is the opposite direction. The instability is the finding: ~2 points of round-to-round noise is larger than most real changes and needs a bigger sample.","timestamp":1785626737501,"segment":0}
