{"run":26,"commit":"02bfe02","metric":872.9,"metrics":{"est_tokens":218218,"outline_chars":207636,"chars_search":302351,"chars_transcript":570522,"rejected_calls":0,"schema_chars":4126,"workflow_a_chars":174189,"workflow_b_chars":128057,"workflow_located":11,"prose_lost":0},"status":"discard","description":"investigated search ranking as a token lever and found nothing to fix. Ground truth: the session an agent went on to READ after each real search. Measured against the results agents actually saw - median rank 1, 46.8% chose hit #1, 59.6% top-3, MRR 0.548. Ranking is healthy; optimising it would be speculative. Also caught my own bad measurement: the first version re-ran queries against the frozen corpus and reported 9.4% rank@1, which was corpus drift and replay infidelity, not ranking. bench/ranking.py now reads rank out of the historical tool results and documents why re-running is wrong. No production change.","timestamp":1785453282450,"segment":0}
{"run":27,"commit":"5b1f326","metric":872.9,"metrics":{"est_tokens":218218,"outline_chars":207636,"chars_search":302351,"chars_transcript":570522,"rejected_calls":0,"schema_chars":4126,"workflow_a_chars":174189,"workflow_b_chars":128057,"workflow_located":11,"prose_lost":0},"status":"keep","description":"bench/all.sh: re-verify every claim this loop makes in one command (build, 13 guards, dev+holdout replay, retention, workflow, ranking, schema size, skill drift). It immediately earned itself by catching a mistake of mine: `recall skill install` writes what is embedded in the running binary, so editing SKILL.md and installing without rebuilding first re-installs the previous text - which is what had happened to all three copies. Rebuilt, reinstalled, drift now zero, and the footgun is documented at the function.","timestamp":1785453500581,"segment":0}
{"run":28,"commit":"cef575f","metric":872.9,"metrics":{"est_tokens":218218,"outline_chars":207636,"chars_search":302351,"chars_transcript":570522,"rejected_calls":0,"schema_chars":4126,"workflow_a_chars":174189,"workflow_b_chars":128057,"workflow_located":11,"prose_lost":0},"status":"keep","description":"index never removed sessions whose source file was deleted, so it only accumulates dead rows: 84 of 87 claude and 128 codex sessions were searchable but unreadable, each costing an agent a wasted read. Added `recall index --full --prune`, which drops what a completed full scan never emitted - 212 rows here, and a 39-session sample afterwards was 39/39 readable with cursor/pi/obsidian untouched. Safety is the point: --prune without --full errors, an empty scan prunes nothing, sources are isolated, tags survive. Tried self-healing on read first and removed it - read handles are query_only so the delete silently did nothing.","timestamp":1785454371729,"segment":0}
{"run":29,"commit":"cef575f","metric":872.9,"metrics":{"est_tokens":218218,"outline_chars":207636,"chars_search":302351,"chars_transcript":570522,"rejected_calls":0,"schema_chars":4126,"workflow_a_chars":174189,"workflow_b_chars":128057,"workflow_located":11,"prose_lost":0},"status":"discard","description":"index-quality hunt produced three rejections and no shippable change. (1) 90% of codex sessions share two boilerplate titles, but fixing looksLikeWrapper makes them WORSE - the next user message is 'Continuation guidance:' and these runs contain no human question at all. (2) Trivial sessions are 6% of the corpus and agents chose 0 of them, but they are only 4.5% of hits shown (~1.6% of workload chars) and msg_count is a crude proxy that would hide real short answers. (3) The near-duplicate codex runs are the corpus being honest about the work, not a recall defect. Search-result quality is not a remaining lever: ranking already measures healthy and titles cannot be improved.","timestamp":1785454749004,"segment":0}
{"type":"config","name":"recall: cold full-index wall time (autoresearch.md's stated primary)","metricName":"full_index_seconds","metricUnit":"s","bestDirection":"lower"}
{"run":1,"commit":"ced6945","metric":155.03,"metrics":{"cursor_s":45.67,"pi_s":50.2,"codex_s":19.74,"cursor_agent_s":33.26,"sessions":3583},"status":"keep","description":"baseline for autoresearch.md's stated primary metric, cold full index of 3,583 sessions. Also fixed bench.sh, which did `rm -rf $HOME/.recall` for its --full run: that would have destroyed the live shared index, the durable tags stored in it, and the frozen bench corpus. It now benchmarks against a scratch RECALL_INDEX and refuses to run against the live one. Phases are serial: pi 50.2s, cursor 45.7s, cursor-agent 33.3s, codex 19.7s, obsidian 4.4s, claude 0.05s.","timestamp":1785455090912,"segment":0}
{"run":2,"commit":"ced6945","metric":197.16,"metrics":{"cursor_s":194.78,"pi_s":110.9,"codex_s":21.32,"cursor_agent_s":18.51,"sessions":3541},"status":"discard","description":"parallel adapters made it 27% WORSE (155->197s) and are reverted. The backlog assumed parsing was the cost and that streaming would make parallelism viable; all six adapters do stream now, so the prerequisite was met - but a --scan-only probe shows parsing is only 36.2s of 155s. Writing is 76%: pi 50.2s total vs 3.1s parsing, cursor-agent 33.3s vs 0.3s, codex 19.7s vs 0.7s. Adapters therefore just queue on the single SQLite writer, and cursor's own phase went 45.7s -> 194.8s waiting on the mutex. The lever is ingest, not parse: 'parallel bubble decode within cursor' targets the wrong 20%.","timestamp":1785456053984,"segment":0}
{"run":3,"commit":"ed6c75f","metric":44.73,"metrics":{"cursor_s":32.93,"pi_s":7.29,"codex_s":1.36,"cursor_agent_s":1.49,"sessions":3583},"status":"keep","description":"155.03s -> 44.73s (3.47x). Instrumenting ingest showed delFTS = 110.6s of the 155s run, against 3.3s to insert all 436k messages: messages_fts.session_pk is UNINDEXED, so DELETE ... WHERE session_pk = ? scans the whole FTS table once per session, and on a cold build it scans to delete nothing. Now guarded by a primary-key lookup on sessions. Verified: same 3,583 sessions, FTS counts match, and the 35 duplicate (session_pk,idx) groups are pre-existing - identical count in the old-code bench.sqlite and the live index. New test pins that re-ingest still replaces rather than duplicating.","timestamp":1785456939620,"segment":0}
{"run":4,"commit":"c6e96eb","metric":42.6,"metrics":{"cursor_s":31.03,"pi_s":7.16,"codex_s":1.18,"cursor_agent_s":1.38,"sessions":3583},"status":"discard","description":"parallel bubble decode in cursor bought 44.73 -> 42.60s (4.8%) and is reverted: not worth ~60 lines of worker pool plus a full copy of all 4.3GB of blobs. The backlog's premise was wrong - reading every bubble blob with NO decoding at all takes 29.19s (248,340 blobs, 4.33GB), against a 31.0s cursor phase, so decode is only ~2s and cursor is I/O-bound. That also sets the floor: ~29s cursor read + ~7s pi + ~3s others + FTS optimize is roughly 40s, so the current 44.73s is within about 12% of what this design can reach.","timestamp":1785457255174,"segment":0}
{"run":5,"commit":"ec17f36","metric":43.95,"metrics":{"refull_seconds":57.02,"cursor_s":31.5,"pi_s":7.2,"codex_s":1.2,"cursor_agent_s":1.4,"sessions":3583},"status":"keep","description":"make the FTS delete seekable (schema v5). A session's messages go into messages_fts consecutively, so their rowids form a run; msg_ranges records it and the delete becomes DELETE ... WHERE rowid BETWEEN lo AND hi on the FTS primary key instead of a full scan of an UNINDEXED column. Re-running --full over a populated index: ~400s -> 57s (7x), which is the path `--full --prune` uses. Cold build unchanged at 43.95s. Sessions indexed before v5 have no run recorded and fall back to the scanning delete, so no migration or forced rescan is needed - the index heals as sessions are touched. The append path records its own run, or those rows would be orphaned. Two tests pin exact replacement, neighbour safety, the pre-v5 fallback and append deletability.","timestamp":1785543698091,"segment":0}
{"type":"config","name":"recall: transcript presentation — tokens an agent reads per real workload","metricName":"workload_kch","metricUnit":"","bestDirection":"lower"}
{"run":1,"commit":"1223742","metric":857.4,"metrics":{"chars_transcript":563039,"chars_search":294377,"outline_chars":207636,"schema_chars":4126,"est_tokens":214354},"status":"keep","description":"transcript message header: `## msg 20/1371 toolResult` -> `## 20 tool ffgrep`. Denser AND more informative. The /TOTAL was already in the session header one line above, so repeating it per message cost ~20k chars across the workload for no information; and a tool result never said which tool produced it, forcing a reader to match results to calls by position. pi records toolName and isError on every result and we were dropping both - same class as the model/usage fields. 864.9 -> 857.4 kch on the same corpus with the pre-change binary as control. Guard updated to match the new format while still asserting the property it protects (a slice is self-locating).","timestamp":1785544581482,"segment":0}
{"run":2,"commit":"1223742","metric":855.7,"metrics":{"chars_transcript":563039,"chars_search":292694,"outline_chars":207636,"schema_chars":4126,"est_tokens":213933},"status":"discard","description":"stripping tool-call markers from the search index: real defect, no real benefit, reverted. The statistic was true - 68% of 'bash' hits and 88% of 'edit' hits matched ONLY via a synthesised [tool:x] marker, with no prose on the subject. But a controlled A/B on the same corpus (old binary vs new, same 108 real queries, ground truth = the session the agent actually went on to read) showed rank@1 identical at 10, MRR identical at 0.154, and one query regressed from rank 4 to absent. Agents search '<ticket-id>' and 'e2e tests staging', not 'bash'. Root cause of the regression: 13% of messages are nothing but a marker, so stripping empties them and drops 94,892 documents from the index, shifting every bm25 score. A true observation about a query pattern nobody uses.","timestamp":1785545117883,"segment":0}
{"run":3,"commit":"33bf6ce","metric":883.2,"metrics":{"chars_transcript":598699,"chars_search":284503,"outline_chars":207794,"schema_chars":4126,"est_tokens":220800},"status":"keep","description":"show the tool-call argument in transcripts: `[tool:bash] git log --oneline -5` instead of a bare `[tool:bash]`. bash and read are 72% of all calls and for both the identifying argument was invisible - you saw output but not the command, file content but not the filename. Clipped to 70 chars, only the identifying field (command/path/query/pattern), so edit/write bodies (1k-4.5k chars of args) stay out. PRIMARY ROSE 3.0% (857.4 -> 883.2) and I am keeping it: this is an information-for-tokens trade, and it is the question that was asked. Search quality is provably untouched - the argument is stripped in trimText so it never reaches the index, and ranking against real agent behaviour is identical (rank@1 10, MRR 0.153, zero lost).","timestamp":1785545857321,"segment":0}
{"run":4,"commit":"f499383","metric":884,"metrics":{"chars_transcript":598699,"chars_search":285349,"outline_chars":207794,"schema_chars":4126,"est_tokens":221012},"status":"keep","description":"make tool-call presentation consistent across every source. Round 16 only fixed pi, leaving cursor-agent under-showing (6,778 markers with no argument at all) and codex over-showing (400 chars of raw JSON per call, which buries the one field that identifies it). Both now use the shared clipped summary, moved out of pi.go so one rule governs all adapters. Also closed a real gap in round 16's index strip: it matched [tool:x] and [tool_use:x] but not codex's [call x] form, so 5,322 codex messages still had command text in the FTS index - now 7. Ranking A/B unchanged (rank@1 10, MRR 0.154 vs 0.153 baseline). The Lua parity test caught that the plugins render differently from the Go adapters; both plugins updated and a new test pins the agreement on a call that actually has an argument, which the existing fixtures did not cover.","timestamp":1785546376791,"segment":0}
{"run":5,"commit":"cc6a84e","metric":883.3,"metrics":{"chars_transcript":598699,"chars_search":284580,"outline_chars":207794,"schema_chars":4126,"est_tokens":220819},"status":"keep","description":"codex tool results now name their tool, and two redundancies are gone. codex records call_id on both the call and its output but the adapter discarded the link, so a reader saw '## 7 tool' with no indication of which tool produced the output below it - pi has named its tools since round 14. Correlating call_id gives '## 7 tool exec_command'. That made the '[output] ' body prefix (4,818 messages, ~43k chars) and the '[call name] ' prefix redundant with the header, so both are dropped. Ranking A/B unchanged (rank@1 10, MRR 0.153). Outline still collapses codex tool runs and --role tool still filters, since canonicalRole maps 'tool:exec_command' to 'tool'. codex.lua updated for parity, including an arg_summary_raw for codex's arguments-as-JSON-string shape.","timestamp":1785546922382,"segment":0}
{"run":6,"commit":"2efc3d5","metric":883.3,"metrics":{"chars_transcript":598699,"chars_search":284580,"outline_chars":207794,"schema_chars":4126,"est_tokens":220819},"status":"keep","description":"claude was the last source still showing bare tool markers - it stayed invisible through three rounds of this work because this machine has only 3 claude sessions and none contain a tool call. Anthropic links a result to its call (tool_use carries id/name/input, tool_result carries tool_use_id) and the adapter discarded all of it, so a claude transcript showed neither what a tool was asked to do nor which tool produced a result. Now renders '[tool_use:Bash] git log --oneline -5' and attributes results as 'toolResult:Bash', matching pi, codex and cursor-agent. Pinned by fixture rather than by corpus, with Lua parity asserted on the same fixture. Primary and ranking both unchanged (this corpus barely exercises claude); the win is for Claude Code users, whose transcripts were the least informative of the four.","timestamp":1785547181195,"segment":0}
