{"ts":"2026-05-26T01:54:18Z","commit":"9ce22c5","status":"keep","notes":"baseline after incremental indexing","primary":"incremental_index_ms","incremental_index_ms":30,"query_ms":44,"index_size_mb":69.40,"binary_size_mb":9.80,"full_index_seconds":"","counts":"✓=codex,cursor=1514,claude=27,codex=1058,total=2599"}
{"ts":"2026-05-26T01:57:45Z","commit":"80af2a4","status":"keep","notes":"primary switched to full_index_seconds; this run gives the cold baseline","primary":"full_index_seconds","incremental_index_ms":10,"query_ms":44,"index_size_mb":69.71,"binary_size_mb":9.80,"full_index_seconds":"86.07","counts":"✓=codex,cursor=1514,claude=27,codex=1058,total=2599"}
{"ts":"2026-05-26T03:14:35Z","commit":"de8245b","status":"discard","notes":"typed struct for bubble decode — marginal, decoder still walks toolFormerData","primary":"full_index_seconds","incremental_index_ms":10,"query_ms":34,"index_size_mb":200.33,"binary_size_mb":9.81,"full_index_seconds":"130.83","counts":"✓=codex,✓=pi,cursor=1514,claude=36,codex=1058,pi=351,total=2959"}
{"ts":"2026-05-26T03:29:41Z","commit":"485661e","status":"keep","notes":"sonic ConfigFastest for JSON decode + typed structs everywhere","primary":"full_index_seconds","incremental_index_ms":10,"query_ms":30,"index_size_mb":199.49,"binary_size_mb":10.76,"full_index_seconds":"95.44","counts":"✓=codex,✓=pi,cursor=1517,claude=36,codex=1058,pi=351,total=2962"}
{"ts":"2026-05-26T03:36:32Z","commit":"485661e","status":"keep","notes":"All adapters use typed event structs; sonic ConfigFastest for decode","primary":"full_index_seconds","incremental_index_ms":10,"query_ms":30,"index_size_mb":202.18,"binary_size_mb":10.76,"full_index_seconds":"81.76","counts":"✓=codex,✓=pi,cursor=1517,claude=36,codex=1058,pi=351,total=2962"}
{"ts":"2026-05-26T18:45:31Z","commit":"485661e","status":"discard","notes":"parallel adapter scan REVERTED — RAM pressure made it 2x slower","primary":"full_index_seconds","incremental_index_ms":10,"query_ms":34,"index_size_mb":203.84,"binary_size_mb":10.76,"full_index_seconds":"109.63","counts":"✓=codex,✓=pi,cursor=1517,claude=41,codex=1058,pi=355,total=2971"}
{"ts":"2026-05-26T19:04:25Z","commit":"851c554","status":"keep","notes":"BulkMode SQLite pragmas during ingest — warm A/B confirmed -10%","primary":"full_index_seconds","incremental_index_ms":10,"query_ms":32,"index_size_mb":203.84,"binary_size_mb":10.76,"full_index_seconds":"97.88","counts":"✓=codex,✓=pi,cursor=1517,claude=41,codex=1058,pi=356,total=2972"}
{"ts":"2026-05-26T19:10:01Z","commit":"ba84e0c","status":"keep","notes":"FTS5 automerge=0 during bulk, optimize on close","primary":"full_index_seconds","incremental_index_ms":10,"query_ms":28,"index_size_mb":206.33,"binary_size_mb":10.76,"full_index_seconds":"","counts":"✓=codex,✓=pi,cursor=1517,claude=41,codex=1058,pi=357,total=2973"}
{"ts":"2026-07-21T07:13:42Z","commit":"9e6ab8e","status":"keep","notes":"phrase-aware ftsEscape; --repo git-root walk-up + subdir prefix match; bench.sh empty-metric guard","primary":"full_index_seconds","incremental_index_ms":40,"query_ms":410,"index_size_mb":377.26,"binary_size_mb":12.26,"full_index_seconds":"","counts":"✓=codex,✓=pi,cursor=1550,claude=85,codex=1065,pi=592,cursor-agent=313,obsidian=42,total=3647"}
{"ts":"2026-07-21T07:15:10Z","commit":"9e6ab8e","status":"keep","notes":"AND-first OR-fallback search: query_ms 410->80; phrase support; --repo git-root","primary":"full_index_seconds","incremental_index_ms":40,"query_ms":12,"index_size_mb":377.26,"binary_size_mb":12.25,"full_index_seconds":"","counts":"✓=codex,✓=pi,cursor=1550,claude=85,codex=1065,pi=592,cursor-agent=313,obsidian=42,total=3647"}
{"ts":"2026-07-21T07:17:45Z","commit":"2591f9c","status":"keep","notes":"session-scoped search: --in <id> / --in . (current session, post-compaction recall); MCP session_id on recall_search","primary":"full_index_seconds","incremental_index_ms":40,"query_ms":62,"index_size_mb":377.26,"binary_size_mb":12.26,"full_index_seconds":"","counts":"✓=codex,✓=pi,cursor=1550,claude=85,codex=1065,pi=592,cursor-agent=313,obsidian=42,total=3647"}
{"type":"config","name":"recall: 10x cheaper for agents — tokens an agent must read per real workload","metricName":"workload_kch","metricUnit":"","bestDirection":"lower"}
{"run":1,"commit":"82272cf","metric":5897.1,"metrics":{"est_tokens":1474267,"outline_chars":1714653,"chars_search":302615,"chars_transcript":5594454,"rejected_calls":6},"status":"keep","description":"baseline: replay 323 real agent recall calls (extracted from pi sessions) against frozen bench corpus; measure chars an agent must read","timestamp":1785447620052,"segment":0}
{"run":2,"commit":"3470241","metric":3412.2,"metrics":{"est_tokens":853053,"outline_chars":1714653,"chars_search":302615,"chars_transcript":3109598,"rejected_calls":6},"status":"keep","description":"benchmark fidelity + move applyBigSessionCap into shared transcript path. NOTE: most of the 5897->3412 drop is correcting an overstated baseline (MCP already capped unsliced calls; my CLI replay billed full dumps agents never received). Genuine win is CLI/pipe callers now getting the same guard.","timestamp":1785447776247,"segment":0}
{"run":3,"commit":"91fa543","metric":3033.5,"metrics":{"est_tokens":758374,"outline_chars":1714653,"chars_search":302615,"chars_transcript":2730881,"rejected_calls":6},"status":"keep","description":"clip tool-result bodies at 600 chars with an explicit elision marker (--tool-chars 0 / tool_chars:0 to opt out). Tool output measured at 59% of transcript chars; user/assistant prose untouched.","timestamp":1785447937129,"segment":0}
{"run":4,"commit":"2a6339a","metric":2240.7,"metrics":{"est_tokens":560173,"outline_chars":1064074,"chars_search":302615,"chars_transcript":1938077,"rejected_calls":6},"status":"keep","description":"outline: collapse consecutive tool activity into one run line naming the span, size and tools (bash x4, read x2); fold marker-only assistant turns into the run. Outline chars 1.71M -> 1.06M and the line is more informative than the per-message first-lines it replaces.","timestamp":1785448096655,"segment":0}
{"run":5,"commit":"f31c637","metric":2261.5,"metrics":{"est_tokens":565384,"outline_chars":1064074,"chars_search":302615,"chars_transcript":1958922,"rejected_calls":0},"status":"keep","description":"tolerate quoted/bracketed range args. PRIMARY ROSE 0.9% and I am keeping it anyway: the 6 calls that used to return a one-line error now return real content. Measured in the source transcripts: 9 'invalid index' errors, 5 followed by an immediate retry, so each rejection really cost an extra round-trip the replay cannot credit back. Keeping code, not the number.","timestamp":1785448309986,"segment":0}
{"run":6,"commit":"c4bda3a","metric":1367.2,"metrics":{"est_tokens":341809,"outline_chars":256746,"chars_search":302615,"chars_transcript":1064624,"rejected_calls":0},"status":"keep","description":"adaptive outline density: past a 4k budget, fall back to chapter markers (user turns + tool runs) instead of one line per turn, with a note on how to restore full density. outline_chars 1.06M -> 257k. The result reads as a table of contents of the session's questions, which is better navigation than 200 lines of agent narration.","timestamp":1785448443877,"segment":0}
{"run":7,"commit":"ba3dd54","metric":1370.4,"metrics":{"est_tokens":342601,"outline_chars":259716,"chars_search":302615,"chars_transcript":1067792,"rejected_calls":0,"workflow_a_chars":250047,"workflow_b_chars":123646,"workflow_located":10},"status":"keep","description":"steer agents off outline onto session-scoped search: MCP tool descriptions + a hint in the outline output. Primary +0.2% (the hint line itself costs bytes) but bench/workflow.py measures the path it points at as 21x cheaper for the locating step (~420 vs ~9000 chars) and 2.02x end-to-end over 14 real outline->range navigations, landing in the correct window 10/14.","timestamp":1785448665662,"segment":0}
{"run":8,"commit":"7dde25b","metric":925.9,"metrics":{"est_tokens":231466,"outline_chars":259716,"chars_search":302615,"chars_transcript":623251,"rejected_calls":0,"workflow_a_chars":250288,"workflow_b_chars":122996,"workflow_located":10},"status":"keep","description":"bound a single transcript read at 20k chars, paging the remainder behind the existing next:/range fragment (--max-chars 0 to opt out). Targets requests like range=0:500 that literally mean 'give me half the session' (170k chars); nothing is lost, it arrives a page at a time. transcript chars 1.07M -> 623k.","timestamp":1785448852055,"segment":0}
{"run":9,"commit":"333aae6","metric":925.6,"metrics":{"est_tokens":231400,"outline_chars":259716,"chars_search":302351,"chars_transcript":623251,"rejected_calls":0,"workflow_a_chars":250288,"workflow_b_chars":122996,"workflow_located":10},"status":"keep","description":"docs: rewrite the shipped recall skill around search-inside-a-session instead of outline, document the new bounds and their opt-outs; record remaining ideas. Holdout verified at 6.11x (2480->406) vs dev 6.37x, so the wins generalise rather than fitting the tuned split.","timestamp":1785449142882,"segment":0}
{"run":10,"commit":"5e95adf","metric":872.9,"metrics":{"est_tokens":218218,"outline_chars":207636,"chars_search":302351,"chars_transcript":570522,"rejected_calls":0,"workflow_a_chars":174189,"workflow_b_chars":122996,"workflow_located":10},"status":"keep","description":"enforce the outline budget as a real cap, not just a density switch: sessions with hundreds of user turns still emitted 17-33k in chapter mode (my earlier synthetic test missed this). Outline now honours range, so truncation resumes with range=N: outline=true. Worst real outline 33k -> 5.9k.","timestamp":1785449307008,"segment":0}
{"run":11,"commit":"b68fe64","metric":872.9,"metrics":{"est_tokens":218218,"outline_chars":207636,"chars_search":302351,"chars_transcript":570522,"rejected_calls":0,"workflow_a_chars":174189,"workflow_b_chars":122996,"workflow_located":10},"status":"keep","description":"correct now-stale efficiency claims in the tool descriptions and skill doc: bounding the outline shrank the very gap they cited, so '~9,000 chars / 20x' became wrong. Restated as the currently measured ~4,000 vs ~420 (about 10x). Holdout re-verified: 2480.2 -> 368.6 = 6.73x, matching dev 6.76x.","timestamp":1785449409856,"segment":0}
{"run":12,"commit":"d611d70","metric":872.9,"metrics":{"est_tokens":218218,"outline_chars":207636,"chars_search":302351,"chars_transcript":570522,"rejected_calls":0,"workflow_a_chars":174189,"workflow_b_chars":122996,"workflow_located":10},"status":"keep","description":"add --context N / context: on search (grep -C parity): expand the top hits with surrounding messages so 'find it and show me' is ONE call instead of search+transcript. Primary flat by construction (no historical call used it), but workflow bench adds strategy C at 58.7k vs 174.2k for the observed outline->range path = 2.97x, one round-trip instead of two. Also fixes printTranscript writing to os.Stdout, which would have corrupted MCP's JSON-RPC stream via this path.","timestamp":1785449685159,"segment":0}
{"run":13,"commit":"3257639","metric":872.9,"metrics":{"est_tokens":218218,"outline_chars":207636,"chars_search":302351,"chars_transcript":570522,"rejected_calls":0,"workflow_a_chars":174189,"workflow_b_chars":122996,"workflow_located":10},"status":"keep","description":"document --context in README and the shipped skill. Final verified state: dev 5897.1 -> 872.9 (6.76x), holdout 2480.2 -> 368.6 (6.73x) on calls never tuned against.","timestamp":1785449776419,"segment":0}
{"run":14,"commit":"84c3c0c","metric":872.9,"metrics":{"est_tokens":218218,"outline_chars":207636,"chars_search":302351,"chars_transcript":570522,"rejected_calls":0,"workflow_a_chars":174189,"workflow_b_chars":128057,"workflow_located":11},"status":"keep","description":"fix the path I had been promoting: session-scoped search returned only ONE hit because dedupe was per-session, so 'search inside this session' could never report more than one location. Now keyed per message when SessionID is set. Also compact printHits when all hits share a session (state the 45-char id once). PRIMARY UNCHANGED by construction - zero historical calls used --in - but workflow located rose 10/14 -> 11/14.","timestamp":1785450112815,"segment":0}
{"run":15,"commit":"e6aaa72","metric":872.9,"metrics":{"est_tokens":218218,"outline_chars":207636,"chars_search":302351,"chars_transcript":570522,"rejected_calls":0,"workflow_a_chars":174189,"workflow_b_chars":128057,"workflow_located":11},"status":"keep","description":"hoist the session header when --context expands several hits from one session: identity was restated ~250 chars per hit (title, source, project, started, msgs) with only msg= differing. 3-hit expansion 4.0k -> 3.5k. Primary and workflow flat because both benches exercise single-hit expansion; the win lands on multi-hit session-scoped search, the path the tool descriptions now recommend.","timestamp":1785450270558,"segment":0}
{"run":16,"commit":"d060016","metric":872.9,"metrics":{"est_tokens":218218,"outline_chars":207636,"chars_search":302351,"chars_transcript":570522,"rejected_calls":0,"workflow_a_chars":174189,"workflow_b_chars":128057,"workflow_located":11},"status":"keep","description":"drop title-match rows from session-scoped search (they point at no message, idx -1, and restate a session the caller already chose) and add three permanent guard checks asserting the documented workflows actually work. Those guards are the fix for the class of bug found this round: --in was broken for as long as the docs recommended it. Primary flat (no historical --in calls); guard count 9 -> 12.","timestamp":1785450583357,"segment":0}
{"run":17,"commit":"4f8350b","metric":872.9,"metrics":{"est_tokens":218218,"outline_chars":207636,"chars_search":302351,"chars_transcript":570522,"rejected_calls":0,"schema_chars":4914,"workflow_a_chars":174189,"workflow_b_chars":128057,"workflow_located":11},"status":"keep","description":"found the cost the benchmark never counted: the MCP tool schema is re-sent every agent turn. Across the 79 real sessions that used recall that is 26,661 turns x 6,517 chars = 173.7M chars, 199x all call output combined (cache-discounted in price, but full context-window pressure regardless). Cut rationale prose the model cannot act on while keeping every instruction and the behavioural steer: 6,517 -> 4,914 chars/turn (-24.6%). Now tracked as schema_chars; a test pins both the budget and the steering strings.","timestamp":1785450994561,"segment":0}
{"run":18,"commit":"0b40bac","metric":872.9,"metrics":{"est_tokens":218218,"outline_chars":207636,"chars_search":302351,"chars_transcript":570522,"rejected_calls":0,"schema_chars":4126,"workflow_a_chars":174189,"workflow_b_chars":128057,"workflow_located":11},"status":"keep","description":"merge recall_untag/recall_tags into recall_tag with an action arg, matching the one-verb model the CLI's runTag already documents. Three tools for one concept cost 27% of the per-turn schema for a feature never called once in 79 sessions. schema_chars 4914 -> 4126 (6517 -> 4126 overall, -37%). All three modes verified end-to-end over real MCP stdio plus a regression test; retired names now error rather than lingering as dead aliases.","timestamp":1785451295480,"segment":0}
{"run":19,"commit":"32a855f","metric":872.9,"metrics":{"est_tokens":218218,"outline_chars":207636,"chars_search":302351,"chars_transcript":570522,"rejected_calls":0,"schema_chars":4126,"workflow_a_chars":174189,"workflow_b_chars":128057,"workflow_located":11},"status":"keep","description":"record the per-turn schema finding in the ideas backlog and note why adaptive --context is not yet built (its only metric is one my own feature exercises - circular until coverage of the historically-read range is measured). Final state this round: dev 872.9 / holdout 368.6 both unchanged, schema 6517 -> 4126, all 12 utility guards green, full suite passing.","timestamp":1785451405498,"segment":0}
{"run":20,"commit":"c386b70","metric":872.9,"metrics":{"est_tokens":218218,"outline_chars":207636,"chars_search":302351,"chars_transcript":570522,"rejected_calls":0,"schema_chars":4126,"workflow_a_chars":174189,"workflow_b_chars":128057,"workflow_located":11},"status":"keep","description":"ROOT CAUSE: I had been optimising the MCP surface, but pi agents - the source of 100% of the workload - use the npm extension, which declares its own tools. It never exposed session_id or context on recall_search, so the cheap path was UNREACHABLE from pi; the 0/280 session-scoped searches were not agents ignoring guidance, the parameter did not exist. Its promptGuidelines also actively pushed outline=true. Wired session_id + context through, flipped the guidance, trimmed descriptions 2131 -> 1831. Also fixed --json silently swallowing --context (same accepted-and-ignored failure mode as --in).","timestamp":1785451979896,"segment":0}
{"run":21,"commit":"0bb3908","metric":872.9,"metrics":{"est_tokens":218218,"outline_chars":207636,"chars_search":302351,"chars_transcript":570522,"rejected_calls":0,"schema_chars":4126,"workflow_a_chars":174189,"workflow_b_chars":128057,"workflow_located":11},"status":"keep","description":"drop the extension's duplicate big-session peek: it ran a second --outline subprocess and carried its own copy of the 200-message threshold, both of which the shared transcript path already owns since applyBigSessionCap moved there. One subprocess per transcript call instead of two, and one threshold instead of two free to drift. Verified the binary reproduces the old behaviour exactly (note + outline on a 1032-msg session, full render on a 40-msg one). dev/holdout unchanged.","timestamp":1785452114874,"segment":0}
{"run":22,"commit":"875e6c9","metric":872.9,"metrics":{"est_tokens":218218,"outline_chars":207636,"chars_search":302351,"chars_transcript":570522,"rejected_calls":0,"schema_chars":4126,"workflow_a_chars":174189,"workflow_b_chars":128057,"workflow_located":11},"status":"keep","description":"fourth stale surface, same class as round 4: three installed skill copies (pi, claude, agents) all dated before any of this work, still telling agents to outline. Installed by file copy, so no upgrade ever touches them. Embedded the skill in the binary, added `recall skill install`, and made `recall doctor` flag copies that have fallen behind - drift is now detected instead of discovered. Refreshed all three locally. Tests pin the cheap-path guidance and the repair path.","timestamp":1785452395387,"segment":0}
{"run":23,"commit":"d831a86","metric":872.9,"metrics":{"est_tokens":218218,"outline_chars":207636,"chars_search":302351,"chars_transcript":570522,"rejected_calls":0,"schema_chars":4126,"workflow_a_chars":174189,"workflow_b_chars":128057,"workflow_located":11},"status":"keep","description":"swept for remaining stale agent-facing surfaces rather than finding them one at a time. packages/pi-recall/README.md (ships to npm) still documented outline as the cheap table of contents, described recall_transcript as read-in-full, and listed the retired recall_untag/recall_tags. Rewritten around search-inside-a-session + context, with the actual output bounds. Verified recall_untag/recall_tags are now referenced nowhere outside tests. dev/holdout unchanged, 12 guards green, TS typecheck clean.","timestamp":1785452538043,"segment":0}
{"run":24,"commit":"dcde722","metric":872.9,"metrics":{"est_tokens":218218,"outline_chars":207636,"chars_search":302351,"chars_transcript":570522,"rejected_calls":0,"schema_chars":4126,"workflow_a_chars":174189,"workflow_b_chars":128057,"workflow_located":11,"prose_lost":0},"status":"keep","description":"validated that the 6.76x cost no signal, using the pre-optimisation binary as ground truth over the real workload (bench/retention.py). prose_lost = 0: no user/assistant text disappeared without a pointer to it. The savings are 2.88M chars of tool output (recoverable via tool_chars=0) and 527k of prose deferred behind explicit continuations; 53 of 61 windowed reads complete untouched, and 6 of the 8 that page had asked for >=100 messages. Added a self-contained guard so partial delivery can never become silent truncation.","timestamp":1785452821501,"segment":0}
{"run":25,"commit":"02bfe02","metric":872.9,"metrics":{"est_tokens":218218,"outline_chars":207636,"chars_search":302351,"chars_transcript":570522,"rejected_calls":0,"schema_chars":4126,"workflow_a_chars":174189,"workflow_b_chars":128057,"workflow_located":11,"prose_lost":0},"status":"keep","description":"closed the last open technical idea by taking the measurement I had said to take first, then rejecting the feature on it: adaptive --context would solve a problem a larger N already solves. Coverage of what agents historically read is 59% at ctx=5 and 100% at ctx=10 wherever search located correctly; the residual misses are '-60: read the end' requests, which are not search tasks. Guidance in the skill and extension now states what each N buys instead of asserting a default. Guard count 12 -> 13.","timestamp":1785452984234,"segment":0}
